{
  "id": "agent2plugin-demo",
  "name": "示例插件",
  "version": "0.1.0",
  "protocol": 1,
  "description": "一个最小可运行的插件，演示如何实现 Provider trait 并打包分发。适合作为自己写插件的起点。",
  "homepage": "https://github.com/Agent2plugin/Agent2plugin",
  "license": "AGPL-3.0",
  "official": true,
  "release": {
    "repo": "Agent2plugin/Agent2plugin",
    "tag": "demo-v{version}",
    "asset": "{id}-{version}-{target}.zip"
  },
  "platforms": [
    "x86_64-pc-windows-msvc",
    "x86_64-apple-darwin",
    "aarch64-apple-darwin",
    "x86_64-unknown-linux-gnu",
    "aarch64-unknown-linux-gnu"
  ],
  "providers": [
    { "id": "demo", "label": "示例提供商", "order": 0, "default_enabled": false }
  ]
}
